Tweets,date,source,image_url,sentiment
"At least two locations have set new record river crests, and now two dams are in danger in North Carolina as # Florence's prolific rainfall continues: https://wxch.nl/2NQ9rDg pic.twitter.com/X2XpkJ02Qo",9/16/2018 21:52,https://twitter.com/weatherchannel/status/1041505092799815683,https://pbs.twimg.com/media/DnQq6TrW4AEmcOG.jpg,-1
These visuals only tell part of the story. # Florencepic.twitter.com/Gz0mqxIMVp,9/16/2018 19:47,https://twitter.com/weatherchannel/status/1041473770341498881,,0
NEW: # Florence has set preliminary # tropical cyclone state rain records in both North Carolina and South Carolina: https://wxch.nl/2QDO5rp pic.twitter.com/2r6AQxC7Py,9/16/2018 18:25,https://twitter.com/weatherchannel/status/1041452956212764674,https://pbs.twimg.com/media/DnP73xYW0AI5VGy.jpg,1
"The # Florence rainfall total in Marion, SC is quickly approaching the state record for tropical cyclone rainfall.pic.twitter.com/3yUMEdpJXH",9/16/2018 17:22,https://twitter.com/weatherchannel/status/1041437113370193921,https://pbs.twimg.com/media/DnPtflnU4AA2ZxT.jpg,0
"A flood disaster is under way in parts of the Carolinas. # Florence has dropped over 30"" of rain in some areas with more expected. The Weather Channel continues to bring you the latest all night long.pic.twitter.com/CCTlz5PZ2x",9/16/2018 17:11,https://twitter.com/weatherchannel/status/1041434480681082881,https://pbs.twimg.com/media/DnPq50dUYAA9Fvm.jpg,1
NEW: # Tornado watch issued for parts of southeastern North Carolina and northeastern South Carolina until 11 p.m. EDT.pic.twitter.com/COPSm7jvaC,9/16/2018 16:16,https://twitter.com/weatherchannel/status/1041420633878548481,https://pbs.twimg.com/media/DnPejBtW4AE2xbx.jpg,1
"NEW: Flash Flood Emergency issued for Mecklenburg County, NC until 7:30 p.m. Includes Charlotte metro. Water rescues have been reported on south side of the city.pic.twitter.com/MXe3xXnhdm",9/16/2018 13:39,https://twitter.com/weatherchannel/status/1041381171568037889,https://pbs.twimg.com/media/DnO6qBZW4AE6SCW.jpg,1
"We at http://Weather.com would like to feature your post. Where and when did you take this? If we have your permission, respond using the hashtag # yesweather. Full terms at https://weather.com/en-US/twc/privacy-policy ….",9/16/2018 13:24,https://twitter.com/weatherchannel/status/1041377371218239489,,1
"We've got the latest on heavy rain, storm surge and flooding as we continue to track # Florence.pic.twitter.com/x8IaK1DEbN",9/16/2018 13:20,https://twitter.com/weatherchannel/status/1041376367001182210,,1
"Where and when did you take this? Could we at http://Weather.com feature your post on our platforms? If so, verify by responding with the hashtag # yesweather. View terms at https://weather.com/en-US/twc/privacy-policy ….",9/16/2018 12:53,https://twitter.com/weatherchannel/status/1041369451466244097,,0
", we'd love to feature your post on http://Weather.com ! Where and when did you take it? To let us know if we have your permission, respond using the hashtag # yesweather. https://weather.com/en-US/twc/privacy-policy …",9/16/2018 11:35,https://twitter.com/weatherchannel/status/1041349919251070976,,1
"Over 30"" of rain has fallen from # Florence with more on the way. The dangerous flood threat is ongoing for the Carolinas. Rivers will continue to rise into this week, with over 20 expected to crest in major flood stage. We are LIVE 24/7 with the latest updates.pic.twitter.com/QhqI7Lf5d7",9/16/2018 10:56,https://twitter.com/weatherchannel/status/1041340137270071298,https://pbs.twimg.com/media/DnOUyBOXsAATJKl.jpg,1
North Carolina's record heaviest rainfall total from a tropical cyclone has risen to nearly 34 inches (preliminary): https://wxch.nl/2NbtNqZ pic.twitter.com/HqGdXSEldc,9/16/2018 10:21,https://twitter.com/weatherchannel/status/1041331257173524480,https://pbs.twimg.com/media/DnONHNAU0AA4yZf.jpg,1
Death toll from # Typhoon # Mangkhut in the Philippines rises to at least 36: https://wxch.nl/2pclAV7 pic.twitter.com/52asUncJbh,9/16/2018 9:31,https://twitter.com/weatherchannel/status/1041318648156180485,https://pbs.twimg.com/media/DnOBs06VsAASmBj.jpg,-1
# Florence has caused 10 deaths in North Carolina and forced portions of Interstate 95 to close: https://wxch.nl/2QtdrYC pic.twitter.com/4Fe7KKlqEw,9/16/2018 8:46,https://twitter.com/weatherchannel/status/1041307431211618304,https://pbs.twimg.com/media/DnN3e56VAAAyKue.jpg,-1
"Numerous water rescues as the heavy rain and catastophic flood threat continues for the Carolinas, with widespread road closures in central and eastern North Carolina. Our LIVE 24/7 coverage continues with the latest on the flood threat.pic.twitter.com/eGh27zIIMb",9/16/2018 8:21,https://twitter.com/weatherchannel/status/1041301138161721345,https://pbs.twimg.com/media/DnNxmc2WsAE5q-W.jpg,1
Remnants of # Florence will bring a soaking rain and possible flooding to the Northeast early this week: https://wxch.nl/2NLcw7p pic.twitter.com/WxKtOrjR5J,9/16/2018 7:54,https://twitter.com/weatherchannel/status/1041294124794740736,https://pbs.twimg.com/media/DnNf6JZU0AAYGiE.jpg,1
"# Florence is now a tropical depression, but its siege of heavy rain and flooding continues today: https://wxch.nl/2D3jJeX pic.twitter.com/rDVMgQxQiJ",9/16/2018 7:19,https://twitter.com/weatherchannel/status/1041285494510968832,https://pbs.twimg.com/media/DnNjkUBVYAI_59O.jpg,-1
NEW: # Tornado watch issued for southeast North Carolina and northeast South Carolina until 5 p.m. EDT.pic.twitter.com/WZwUY5EGth,9/16/2018 6:56,https://twitter.com/weatherchannel/status/1041279675413291013,https://pbs.twimg.com/media/DnNeWKxXcAEBJi3.jpg,1
Typhoon # Mangkhut has made landfall in China southwest of Hong Kong with strong winds and heavy rainfall: https://wxch.nl/2xgx9Pt pic.twitter.com/JIHftMZJAC,9/16/2018 6:46,https://twitter.com/weatherchannel/status/1041277012047011840,https://pbs.twimg.com/media/DnNXQdeU0AIx5uS.jpg,1
"We at http://Weather.com would like to feature your post. Where and when did you take this? If we have your permission, respond using the hashtag # yesweather. Full terms at https://weather.com/en-US/twc/privacy-policy ….",9/16/2018 6:10,https://twitter.com/weatherchannel/status/1041268051369512960,,1
5 a.m. EDT: # Florence has weakened to a tropical depression. High threat of # flooding continues.pic.twitter.com/iaosNHxPhg,9/16/2018 5:05,https://twitter.com/weatherchannel/status/1041251792464621569,https://pbs.twimg.com/media/DnNE_KSXsAAeGIs.jpg,1
"Additional rainfall amounts of up to 1 feet in spots as rain trains over the same area. By Sunday afternoon, # Florence will pick up in movement and head to the Northeast by early in the week.pic.twitter.com/dWw1r7ZrIP",9/16/2018 2:19,https://twitter.com/weatherchannel/status/1041209818386771968,https://pbs.twimg.com/media/DnMexpPXgAAjOvU.jpg,1
# Mangkhut (locally # OmpongPH) is now blamed for killing 28 people in the northern Philippines after making landfall there as a Category 5 equivalent super typhoon. The latest impacts in Luzon: https://wxch.nl/2pclAV7 (Photo: AP/Aaron Favila)pic.twitter.com/ygZl2ZJbj9,9/15/2018 23:57,https://twitter.com/weatherchannel/status/1041174225103544320,https://pbs.twimg.com/media/DnL-PlkU8AAX39b.jpg,1
"Life-threatening, catastrophic flash floods and prolonged significant river flooding are likely over portions of the Carolinas through early next week. Landslides are possible in the higher terrain of the Southern & Central Appalachians across Western NC & SW VA. # Florencepic.twitter.com/3SLTa7yAxJ",9/15/2018 23:48,https://twitter.com/weatherchannel/status/1041171837705703424,https://pbs.twimg.com/media/DnL77vLXsAIFILz.jpg,1
Our coverage continues as we track catastrophic flooding from # Florence.pic.twitter.com/qo7mIQaTe2,9/15/2018 22:26,https://twitter.com/weatherchannel/status/1041151299851636736,,0
Rainfall and flooding impacts from # Florence. Our live coverage continues throughout the storm.pic.twitter.com/BRXKN8sjn9,9/15/2018 21:07,https://twitter.com/weatherchannel/status/1041131461653479424,,1
Water continues to pose a significant threat from # Florence. The Weather Channel will continue to bring you the latest all weekend long.pic.twitter.com/p427Z635EU,9/15/2018 17:24,https://twitter.com/weatherchannel/status/1041075361205903360,,1
Center of # Florence continues its slow westward trek across eastern South Carolina. Heavy rains and catastrophic flooding continue across portions of North Carolina and South Carolina.pic.twitter.com/k2WqKV9pMb,9/15/2018 17:05,https://twitter.com/weatherchannel/status/1041070553321357312,https://pbs.twimg.com/media/DnKgEgEU8AElQUj.jpg,-1
"NEW: # Tornado watch issued for southeastern North Carolina, including Wilmington, until 11 p.m. EDT. # Florencepic.twitter.com/i1LQd2xjyM",9/15/2018 16:39,https://twitter.com/weatherchannel/status/1041064063323856896,https://pbs.twimg.com/media/DnKaP4YW4AAPWjq.jpg,1
"# Florence sets a preliminary North Carolina state rain record, the third state to do so in 12 months: https://wxch.nl/2NgkGVZ pic.twitter.com/yZ67pTIjxA",9/15/2018 16:02,https://twitter.com/weatherchannel/status/1041054711519096832,https://pbs.twimg.com/media/DnKQ8exW0AAgYdS.jpg,0
"Footage of the destruction caused by # Florence continues to come in. If you're impacted by the storm, please stay safe and pay attention to your local officials. Stay with The Weather Channel for the latest on Florence.pic.twitter.com/qNnatQmhfO",9/15/2018 14:20,https://twitter.com/weatherchannel/status/1041029056974794752,,1
"# Florence continues to bring heavy rain to the Carolinas, watch our LIVE 24/7 coverage for the latest on the storm.pic.twitter.com/ko7BxTdeU8",9/15/2018 14:04,https://twitter.com/weatherchannel/status/1041025034591129601,https://pbs.twimg.com/media/DnJ2siEV4AA0OSm.jpg,1
"""We face walls of water."" # Florence kills 5 in North Carolina, forces new evacuations as # flood waters rise. https://wxch.nl/2NLXlLe pic.twitter.com/Ep9T4c3FRi",9/15/2018 11:39,https://twitter.com/weatherchannel/status/1040988465226244097,https://pbs.twimg.com/media/DnJVXmYVsAApdPt.jpg,1
11a ET Update: # Florence is crawling westward across eastern South Carolina. Heavy rains and catastrophic flooding continue across portions of the Carolinas. We are live 24/7 through the weekend to bring you the latest on the storm.pic.twitter.com/sYVPXJ4ei9,9/15/2018 11:03,https://twitter.com/weatherchannel/status/1040979342761840640,https://pbs.twimg.com/media/DnJNI1HVYAEu2tC.jpg,1
"The remnants of # Florence will bring rain, locally heavy in spots, to the Northeast early next week before finally exiting the U.S.: https://wxch.nl/2QxDTR1 pic.twitter.com/weNTksY2QZ",9/15/2018 10:14,https://twitter.com/weatherchannel/status/1040966969523138560,https://pbs.twimg.com/media/DnId1aXXsAAwpZ1.jpg,-1
# Typhoon # Mangkhut is heading for southeast China after hammering the northern Philippines: https://wxch.nl/2Qf4J0g pic.twitter.com/e8LlO7Eyie,9/15/2018 9:06,https://twitter.com/weatherchannel/status/1040949856632799234,https://pbs.twimg.com/media/DnIe4F1X0AAXZs1.jpg,0
"An additional 1-2 FEET of rain remains possible in the Carolinas from Tropical Storm # Florence, along with a tornado threat. Power outages are approaching 1 Million. We are LIVE with you throughout the storm 24/7.pic.twitter.com/0HRUYOXYCs",9/15/2018 8:32,https://twitter.com/weatherchannel/status/1040941481228464128,,1
Coastal and inland flooding remain the greatest threats from Tropical Storm # Florence as it is barely moving across the Carolinas. More than 1 FOOT of rain is still possible through the weekend. Our crews are LIVE 24/7 with the latest updates and forecast.pic.twitter.com/aLaYfntGBE,9/15/2018 8:20,https://twitter.com/weatherchannel/status/1040938474516500480,https://pbs.twimg.com/media/DnImOtcXsAA0o1U.jpg,1
Flash # flood emergencies continue in parts of eastern North Carolina as # Florence moves slowly. Here's the latest on the storm: https://wxch.nl/2Qydq5H pic.twitter.com/Ve4BILWwCD,9/15/2018 7:49,https://twitter.com/weatherchannel/status/1040930480345047040,https://pbs.twimg.com/media/DnIgjkWW4AAmN16.jpg,1
"700,000+ power outages in the Carolinas and that number continues to climb as # Florence brings more strong wind and flooding rain. Our crews are LIVE 24/7 with you throughout the storm to bring you the latest conditions and forecast.pic.twitter.com/rCSJGrHK83",9/15/2018 7:30,https://twitter.com/weatherchannel/status/1040925696837660672,https://pbs.twimg.com/media/DnIVbfSWsAIX-lW.jpg,1
River # flooding by next week could rival flooding from Matthew and Floyd in parts of the Carolinas: https://wxch.nl/2CY34cD # Florencepic.twitter.com/AvZN3OOWV3,9/15/2018 7:26,https://twitter.com/weatherchannel/status/1040924924192415744,https://pbs.twimg.com/media/DnIbhrHWwAAtqs1.jpg,0
"# Florence remains a strong tropical storm bringing gusty wind & potentially catastrophic flooding to the Carolinas. Up to 18""+ of rain could still fall through the weekend as power outages continue to climb. @ kellycass, @ JenCarfagno and @ StephanieAbrams are LIVE now w/ the latestpic.twitter.com/B7Ch0fvqlU",9/15/2018 6:32,https://twitter.com/weatherchannel/status/1040911197774774272,https://pbs.twimg.com/media/DnIOOeyXoAEG8RZ.jpg,1
Rainfall will continue to be the big story as # Florence trudges ever so slowly to the west dumping additional rainfall amounts of 1-2 feet in spots! Flash Flooding will continue to be a big threat into early next week as torrential rain will continue over the same areas.pic.twitter.com/MR2K2wpVex,9/15/2018 2:03,https://twitter.com/weatherchannel/status/1040843628233588736,https://pbs.twimg.com/media/DnHRuj_XoAAArg2.jpg,-1
Tropical Storm # Florence has weakened to a 60 mph storm. It is still an intense system that will continue to bring strong gusty winds across North and South Carolina.pic.twitter.com/NCnfQSsmBF,9/15/2018 2:02,https://twitter.com/weatherchannel/status/1040843329276137472,https://pbs.twimg.com/media/DnHRXR-XcAAfhg6.jpg,1
These are just a few glimpses of the damage dealt by # Florence. Stick with The Weather Channel for the latest on Florence all weekend long.pic.twitter.com/VSLgzj7DiF,9/15/2018 0:42,https://twitter.com/weatherchannel/status/1040823181349724161,,1
"# Florence will cause flash # flooding, along with major to record river flooding in the Carolinas and southwestern Virginia this weekend and into next week: https://wxch.nl/2CYv14e pic.twitter.com/sdyIk4NG5Q",9/14/2018 23:44,https://twitter.com/weatherchannel/status/1040808508730613761,https://pbs.twimg.com/media/DnGxohDWsAE01xQ.jpg,1
NEW: # Tornado watch issued for southeastern North Carolina until 7 a.m. EDT Saturday. # Florencepic.twitter.com/pAu2VOpvtQ,9/14/2018 23:04,https://twitter.com/weatherchannel/status/1040798424361254912,https://pbs.twimg.com/media/DnGopq3W0AEyCFG.jpg,1
"Tropical Storm # Florence continues to crawl along the North Carolina-South Carolina border. Life-threatening flooding, both near the coast and inland, has been reported and will continue into Saturday. Watch our 24/7 storm coverage for more details.pic.twitter.com/BdA7ZKrqLq",9/14/2018 22:58,https://twitter.com/weatherchannel/status/1040796937417576448,https://pbs.twimg.com/media/DnGnSiZW0AEEApf.jpg,1
# Florence's remnants will bring a soaking # rain and possible # flooding to the Northeast early next week: https://wxch.nl/2NfNH3W pic.twitter.com/HCTbaD6Yzo,9/14/2018 21:16,https://twitter.com/weatherchannel/status/1040771309595189249,https://pbs.twimg.com/media/DnGPvA8XcAEYDyv.jpg,1
"""It's an emergency situation to say the least."" Stay with our LIVE coverage of # Florence all through the night.pic.twitter.com/L5O9Q0BDJk",9/14/2018 20:54,https://twitter.com/weatherchannel/status/1040765678280683520,,-1
"FLASH FLOOD EMERGENCY for Carteret, Jones, Craven and Pamilico counties in eastern North Carolina. Rain totals are approaching 2 FEET and roads are becoming impassable. Strong words below from @ NWSMoreheadCity. # Florencepic.twitter.com/AWF5f7bNpk",9/14/2018 19:48,https://twitter.com/weatherchannel/status/1040749089925816320,https://pbs.twimg.com/media/DnF7gXSW0AEst3F.jpg,1
"Super Typhoon # Mangkhut made landfall as a Category 5 early Saturday morning in northern Luzon in the Philippines, where it is unleashing destructive winds, flooding rain and coastal flooding: https://wxch.nl/2Mx5grk pic.twitter.com/Wg7GlS7qk0",9/14/2018 19:11,https://twitter.com/weatherchannel/status/1040739955310505985,https://pbs.twimg.com/media/DnFzHUbW0AATErc.jpg,-1
"# Florence has weakend to a Tropical Storm, but still poses a multi-day storm surge, flood and tornado threat as it slowly moves inland. Feet of rain are expected, don't let your guard down. Our live 24/7 coverage continues.pic.twitter.com/uOZusit8kr",9/14/2018 16:51,https://twitter.com/weatherchannel/status/1040704650226352129,,-1
". @ mikebettes has been LIVE in Myrtle Beach, SC all day covering # Hurricane # Florence and conditions are just going to continue to get worse as Florence makes its slow progression inland. Our crews will be live 24/7 through the weekend to keep you updated.pic.twitter.com/JatQhc46lz",9/14/2018 16:39,https://twitter.com/weatherchannel/status/1040701710392602630,,-1
"The Cape Fear River at Wilmington, NC has reached an all-time record high and more than one foot of rain is still forecast from # Hurricane # Florence. We will be LIVE all weekend bringing you the latest updates.pic.twitter.com/j5kematOEE",9/14/2018 16:16,https://twitter.com/weatherchannel/status/1040695770582790144,,1
"# Hurricane # Florence is moving slowly inland, with days of heavy rain, storm surge, possible tornadoes and flooding still to come. We have 18 crews in the field and teams in studio to bring you LIVE 24/7 coverage through the weekend.pic.twitter.com/qHCZetlPUD",9/14/2018 14:11,https://twitter.com/weatherchannel/status/1040664472581537793,https://pbs.twimg.com/media/DnEuhZGX4AAUsUD.jpg,-1
"Hundreds of water rescues this morning as # Hurricane # Florence unleashed heavy rain and brought storm surge to the Carolina Coast. This is only the beginning. Feet of rain, flooding, storm surge and tornadoes are possible through the weekend. We are live 24/7 through the weekend.pic.twitter.com/TTTmqVetTq",9/14/2018 13:49,https://twitter.com/weatherchannel/status/1040658745553027072,,-1
"# Florence is forecast to cause major to record river flooding in parts of the Carolinas into early next week, and it could rival flooding from Matthew and Floyd in some areas: https://wxch.nl/2CY34cD pic.twitter.com/fKV85kmOR3",9/14/2018 13:01,https://twitter.com/weatherchannel/status/1040646832882364418,https://pbs.twimg.com/media/DnEeYVuWwAAb_gJ.jpg,1
Super Typhoon # Mangkhut is approaching the Philippines and then will track toward parts of southeastern China: https://wxch.nl/2xjW9o2 pic.twitter.com/TWm8WxYrBF,9/14/2018 12:38,https://twitter.com/weatherchannel/status/1040640820309843968,https://pbs.twimg.com/media/DnEU7aSXcAYGHJ7.jpg,1
"11:00 AM Update: # Hurricane # Florence remains a powerful hurricane with 80 mph wind as it lashes the Carolinas with heavy rain, storm surge and damaging wind. This will be a prolonged event. We will be LIVE throughout the weekend with the latest updates.pic.twitter.com/TJiECUKQ62",9/14/2018 11:02,https://twitter.com/weatherchannel/status/1040616773329084416,,1
". @ JimCantore and @ StephanieAbrams were LIVE in Wilmington, NC this morning as the eyewall of # Hurricane # Florence battered the city. Our crews are in the field 24/7 to bring you the latest updates as Florence impacts the Carolinas.pic.twitter.com/JRNq5MJydM",9/14/2018 10:46,https://twitter.com/weatherchannel/status/1040612881644101632,,1
"Watch as @ StephanieAbrams goes through the eyewall of Wilmington, NC. This is just the beginning as # Hurricane # Florence continues to bring damaging wind, storm surge and heavy rain to the Carolinas. We are LIVE 24/7 throughout the storm to bring you the latest updates.pic.twitter.com/ahg6ktK1H8",9/14/2018 10:31,https://twitter.com/weatherchannel/status/1040608934506229761,,1
"Where and when did you take this? Could we at http://Weather.com feature your post on our platforms? If so, verify by responding with the hashtag # yesweather. View terms at https://weather.com/en-US/twc/privacy-policy ….",9/14/2018 9:40,https://twitter.com/weatherchannel/status/1040596050418061312,,0
"# Florence has made landfall and will continue to bring heavy rainfall, flooding, storm surge and destructive winds to the Carolinas: https://wxch.nl/2MtZjLL pic.twitter.com/iSEz6ZBPBy",9/14/2018 8:49,https://twitter.com/weatherchannel/status/1040583190421884928,https://pbs.twimg.com/media/DnDgCANX4AAgTsG.jpg,-1
"The heavy rain, inland flood threat and power outages will continue through the weekend. Rivers will be on the rise.pic.twitter.com/XhOL1WFoAC",9/14/2018 8:22,https://twitter.com/weatherchannel/status/1040576509809836032,https://pbs.twimg.com/media/DnDeyrYWsAA0Ds2.jpg,-1
"Latest advisory on Hurricane # Florence: Destructive winds, life-threatening storm surge and heavy rainfall will continue to batter the Carolinas throughout the day.pic.twitter.com/QlTMcbisWV",9/14/2018 8:22,https://twitter.com/weatherchannel/status/1040576508212011008,https://pbs.twimg.com/media/DnDenh4W4AEpVjv.jpg,-1
"Wilmington, NC gusted to 105mph earlier this morning, making it the second strongest wind ever measured there.pic.twitter.com/fxvLZJQfbH",9/14/2018 8:14,https://twitter.com/weatherchannel/status/1040574459957137409,https://pbs.twimg.com/media/DnDc43oW0AEKXPN.jpg,0
Breaking: Hurricane Florence has made landfall with estimated winds of 90 mph. Join us live for more coverage.pic.twitter.com/9LCGfmIoQp,9/14/2018 7:43,https://twitter.com/weatherchannel/status/1040566763216359426,https://pbs.twimg.com/media/DnDV6HDXsAApkU9.jpg,1
"JUST IN: # Hurricane # Florence has made landfall near Wrightsville Beach, NC: https://wxch.nl/2xc2Klb pic.twitter.com/8PzKGsCC4B",9/14/2018 7:43,https://twitter.com/weatherchannel/status/1040566581284298752,https://pbs.twimg.com/media/DnDVvAoXgAYQFjQ.jpg,1
"More than 300,000 homes and businesses have lost power as # Florence roars ashore. Here are the latest impacts: https://wxch.nl/2QtdrYC pic.twitter.com/ndN01LySCO",9/14/2018 7:09,https://twitter.com/weatherchannel/status/1040558047960199168,https://pbs.twimg.com/media/DnDNs7IUcAA3CWs.jpg,1
"Surge, inland flooding and power outages are expected to continue along the coast. Heavy rain, inland flooding and power outage threats will continue through the weekend for parts of western North Carolina, South Carolina and Eastern Georgia.pic.twitter.com/BUGx2fSmOi",9/14/2018 5:31,https://twitter.com/weatherchannel/status/1040533542810185729,https://pbs.twimg.com/media/DnC3bnGUwAA606s.jpg,-1
"5 AM Advisory: # Florence outer eye wall is currently making landfall near Wrightsville Beach, NC. Hurricane and tropical storm-force winds, along with life-threatening surge, continue to batter the North Carolina coast.pic.twitter.com/F6eg5e7vHQ",9/14/2018 5:28,https://twitter.com/weatherchannel/status/1040532802595373058,https://pbs.twimg.com/media/DnC27ksUwAEAGwF.jpg,1
"As of the Friday 2am advisory, # Florence remains a high-end Category 1 hurricane. The North Carolina coast has already experienced hurricane-force wind gusts, as well as life-threatening storm surge.pic.twitter.com/JG5yIL5Qzk",9/14/2018 2:10,https://twitter.com/weatherchannel/status/1040482986280603648,https://pbs.twimg.com/media/DnCJnVCUYAA8-41.jpg,1
"# Hurricane # Florence's very large eye and its vicious eyewall are lurking Just east of Wilmington, North Carolina. This strongest band of rain and wind will carve the coast over the next few hours. More than 20 inches has already fallen in Atlantic Beach.pic.twitter.com/JvjE7arivb",9/14/2018 2:01,https://twitter.com/weatherchannel/status/1040480660698357760,https://pbs.twimg.com/media/DnCGwoZXsAE_Cn4.jpg,-1
". @ mikeseidel got a scare as a transformer exploded behind him. If you're in an area affected by # florence, please use caution.pic.twitter.com/mcbSJYQ39F",9/14/2018 1:37,https://twitter.com/weatherchannel/status/1040474615649202176,,-1
The strong winds and heavy rains from # florence are just getting started. Turn to The Weather Channel for the latest updates all night long.pic.twitter.com/kyb5LHcpV9,9/14/2018 0:16,https://twitter.com/weatherchannel/status/1040454252492193792,,1
"New Bern, North Carolina, meteorologists at @ wcti12 were forced off-air during their broadcast by # Florence's storm-surge flooding. Reports said they were the last two in the building as water built up around the station: https://wxch.nl/2xbxnGM pic.twitter.com/gTRlRcZcm1",9/13/2018 23:55,https://twitter.com/weatherchannel/status/1040448816825155584,https://pbs.twimg.com/media/DnBqNN5WwAEing-.jpg,-1
"Life-threatening surge, inland flooding, and power outages are still likely at the coast, and the heavy rain and power outage threat exists into portions of western NC and SC, along with eastern GA into the weekend. Stay with The Weather Channel for the latest on # Florence.pic.twitter.com/qqX9OLuI4m",9/13/2018 23:20,https://twitter.com/weatherchannel/status/1040440065577689088,https://pbs.twimg.com/media/DnBitZ3U4AAKYIM.jpg,1
Updated list of peak wind gusts from # Florence as of 10:30 p.m. EDT: https://wxch.nl/2CSGYs4 pic.twitter.com/WNYBk0HLSY,9/13/2018 22:36,https://twitter.com/weatherchannel/status/1040429030565179393,https://pbs.twimg.com/media/DnBYmPqW0AA-x53.jpg,0
"100,000+ lose power as Hurricane # Florence slams North Carolina. Floodwaters wash over beaches into cities. The latest: https://wxch.nl/2OkgyRh pic.twitter.com/PYRFuQ0aIa",9/13/2018 22:06,https://twitter.com/weatherchannel/status/1040421428208775168,https://pbs.twimg.com/media/DnBRhmVXgAAFF0q.jpg,1
