Tweets,date,source,image_url,sentiment
A pattern change next week will bring some noticeable changes in the weather - here are 5 things to watch next week: https://wxch.nl/2O3HUhJ pic.twitter.com/Bd1LdbPEWV,9/22/2018 14:14,https://twitter.com/weatherchannel/status/1043564082455109632,https://pbs.twimg.com/media/Dnt3W0bWwAACQfM.jpg,0
The autumnal equinox is at 9:54 p.m. EDT Saturday - here are 4 things to know as fall begins: https://wxch.nl/2I4XVOS pic.twitter.com/DCU8OD3xpF,9/22/2018 11:56,https://twitter.com/weatherchannel/status/1043529353173168128,https://pbs.twimg.com/media/Dnsy-u1UwAEKfF-.jpg,0
Tropical Storm # Kirk has developed south of the Cabo Verde Islands in the eastern Atlantic - here is what we're watching in the tropics: https://wxch.nl/2DooIXS pic.twitter.com/akwNc0sR7Q,9/22/2018 11:14,https://twitter.com/weatherchannel/status/1043518791613706240,https://pbs.twimg.com/media/DntQw8sXoAEqi3l.jpg,1
Refreshing pattern change will bring an extended break from the heat and humidity in the central U.S. and into parts of the East: https://wxch.nl/2PVBdLS pic.twitter.com/6GetVfobIN,9/22/2018 10:33,https://twitter.com/weatherchannel/status/1043508465895845888,https://pbs.twimg.com/media/Dnsx-vfV4AA_qM0.jpg,1
"Heavy rainfall and flash # flooding are expected in parts of Texas, Oklahoma and Arkansas Saturday: https://wxch.nl/2MWK7XP pic.twitter.com/WtL9RAT0sS",9/22/2018 9:14,https://twitter.com/weatherchannel/status/1043488584714588160,https://pbs.twimg.com/media/DnsxfEvV4AA5rT3.jpg,-1
What games are you looking forward to today? # CollegeFootballhttps://twitter.com/AMHQ/status/1043482541662117888 …,9/22/2018 8:51,https://twitter.com/weatherchannel/status/1043483031665881089,,0
Activity in the tropics has increased and we were watching several systems in the # Atlantic and # Trami in the western Pacific: https://wxch.nl/2ps8PFY pic.twitter.com/8JLCcvjCEV,9/22/2018 8:02,https://twitter.com/weatherchannel/status/1043470465732362241,https://pbs.twimg.com/media/DnsklKcU8AEkuxO.jpg,0
Paramedics responded to several calls of people trapped in homes and cars.https://twitter.com/AMHQ/status/1043453596757635073 …,9/22/2018 7:02,https://twitter.com/weatherchannel/status/1043455537793433601,,-1
", we'd love to feature your post on http://Weather.com ! Where and when did you take it? To let us know if we have your permission, respond using the hashtag # yesweather.https://weather.com/en-US/twc/privacy-policy …",9/21/2018 18:33,https://twitter.com/weatherchannel/status/1043267081226137600,,1
A severe thunderstorm watch has been issued for western and northern New York and northwestern Pennsylvania. A couple of tornadoes and damaging wind gusts are possible through this evening.pic.twitter.com/9znnnTnM0k,9/21/2018 16:54,https://twitter.com/weatherchannel/status/1043242000265498624,https://pbs.twimg.com/media/DnpW2FrUwAESwuL.jpg,1
"A severe thunderstorm watch has been issued for parts of eastern Ohio, western Pennsylvania and extreme northern West Virginia. A couple of tornadoes, damaging wind gusts and hail are possible through this evening.pic.twitter.com/0u96VZ7aVz",9/21/2018 16:45,https://twitter.com/weatherchannel/status/1043239855919165440,https://pbs.twimg.com/media/DnpU0_OUcAA4LUk.jpg,-1
"Where and when did you take this? Could we at http://Weather.com feature your post on our platforms? If so, verify by responding with the hashtag # yesweather. View terms at https://weather.com/en-US/twc/privacy-policy ….",9/21/2018 16:19,https://twitter.com/weatherchannel/status/1043233327912763393,,0
"3:10 p.m. CDT: Flash flood emergency continues through 4:45 p.m. Flood waters are now reaching many structures in Ada, Oklahoma. while Fittstown has measured more than 11 inches of rain. Roads are washing out in Fittstown and Stonewall. Stay off the roads! # OKwxpic.twitter.com/9GysUvmKxN",9/21/2018 16:13,https://twitter.com/weatherchannel/status/1043231890965180421,https://pbs.twimg.com/media/DnpNR-NUYAAnzVL.jpg,1
Here's what we're watching in the # tropics as activity starts to increase again: https://wxch.nl/2PVdfQO pic.twitter.com/rrdTdkNal3,9/21/2018 14:22,https://twitter.com/weatherchannel/status/1043203707658219527,https://pbs.twimg.com/media/DnowQoYXsAArH9Q.jpg,0
12:57 p.m. CDT: A flash flood warning has been issued for the Oklahoma City metro area. Two inches of rain has already fallen and more is coming down. Flooding is likely.pic.twitter.com/X0jTJCH5Py,9/21/2018 13:58,https://twitter.com/weatherchannel/status/1043197843484409858,https://pbs.twimg.com/media/DnouhVhW4AAMEL2.jpg,1
"A FLASH FLOOD EMERGENCY is in effect for Fittstown, Jesse and Stonewall, Oklahoma due to torrential rainfall. More flooding is likely across potions of the southern Plains through this evening. Forecast: https://wxch.nl/2psPlRL pic.twitter.com/RBdGJ9YERL",9/21/2018 12:42,https://twitter.com/weatherchannel/status/1043178753512402945,https://pbs.twimg.com/media/Dnoc7RBU8AAOg1q.jpg,1
"We at http://Weather.com would like to feature your post. Where and when did you take this? If we have your permission, respond using the hashtag # yesweather. Full terms at https://weather.com/en-US/twc/privacy-policy ….",9/21/2018 11:23,https://twitter.com/weatherchannel/status/1043158857479069696,,1
An extended period of cooler conditions will develop next week from the central U.S. to the East Coast: https://wxch.nl/2PVBj6e pic.twitter.com/gO01g4H3pJ,9/21/2018 9:21,https://twitter.com/weatherchannel/status/1043127958473338880,https://pbs.twimg.com/media/DnnelfNXcAAk9cU.jpg,0
"Heavy rainfall, # flooding are expected in parts of Texas, Oklahoma and Arkansas into Saturday: https://wxch.nl/2O1yrr7 pic.twitter.com/A7LfftKF6Z",9/21/2018 8:44,https://twitter.com/weatherchannel/status/1043118646858371073,https://pbs.twimg.com/media/DnnZyQgXgAAoLQs.jpg,-1
"Chance of # severe storms will move into the interior Northeast Friday with threat of damaging winds, hail and isolated # tornadoes: https://wxch.nl/2PR5knN pic.twitter.com/nSOcuYuwa4",9/21/2018 8:03,https://twitter.com/weatherchannel/status/1043108329772535809,https://pbs.twimg.com/media/DnnYvSsW4AEJND4.jpg,0
"A tornado watch has been issued for southeastern Minnesota, northeastern Iowa and western Wisconsin. Damaging wind gusts, a couple of tornadoes and large hail are possible.pic.twitter.com/rIjJOepwzC",9/20/2018 19:28,https://twitter.com/weatherchannel/status/1042918548778242048,https://pbs.twimg.com/media/Dnkw0TEU0AAsQrk.jpg,1
"Aerial views of Emerald Isle, North Carolina before and after Hurricane # Florence. We are LIVE with the latest on the aftermath and the # severe weather threat in the Midwest.pic.twitter.com/9q2plD2qs4",9/20/2018 17:15,https://twitter.com/weatherchannel/status/1042885058250661888,,1
A tornado watch has been issued for southern Minnesota. This watch does include southern portions of the Twin Cities metro area. The main threat is for a few tornadoes and damaging wind gusts.pic.twitter.com/Z2lGMPxuoO,9/20/2018 16:37,https://twitter.com/weatherchannel/status/1042875346562035713,https://pbs.twimg.com/media/DnkJiUGVsAA7ixX.jpg,-1
"A severe thunderstorm watch has been issued for portions of IA, NE, KS, MO and SD, including Lincoln and Omaha, Nebraska. The main threat in this area will be damaging wind gusts, but a couple of tornadoes and large hail are also possible.pic.twitter.com/9iihqdcVCl",9/20/2018 16:15,https://twitter.com/weatherchannel/status/1042869760579579904,https://pbs.twimg.com/media/DnkEM9LWsAAchPs.jpg,1
"Where and when did you take this? May http://Weather.com have permission to feature it on our platforms? To verify, respond with # yesweather. Check out the terms at https://weather.com/en-US/twc/privacy-policy …",9/20/2018 15:16,https://twitter.com/weatherchannel/status/1042854933215760384,,0
"Heavy rainfall and possible # flooding are expected in parts of Texas, Oklahoma and Arkansas late this week: https://wxch.nl/2xF6BGU pic.twitter.com/Y6vfC0To1D",9/20/2018 14:54,https://twitter.com/weatherchannel/status/1042849372596129792,https://pbs.twimg.com/media/Dnjgj6ZU4AAIz3V.jpg,-1
These are the images as powerful Hurricane # Maria made landfall in # PuertoRico one year ago today. We are taking a look back at the ongoing recovery efforts and how communities are rallying together on air all day.pic.twitter.com/0IeufPk4Yc,9/20/2018 14:48,https://twitter.com/weatherchannel/status/1042847971208044545,,1
", we'd love to feature your post on http://Weather.com ! Where and when did you take it? To let us know if we have your permission, respond using the hashtag # yesweather.https://weather.com/en-US/twc/privacy-policy …",9/20/2018 14:11,https://twitter.com/weatherchannel/status/1042838699996852225,,1
"Where and when did you take this? May http://Weather.com have permission to feature it on our platforms? To verify, respond with # yesweather. Check out the terms at https://weather.com/en-US/twc/privacy-policy …",9/20/2018 14:11,https://twitter.com/weatherchannel/status/1042838568580919296,,0
"The risk for severe weather, including a few tornadoes, will increase later this afternoon into the evening hours across the Upper Midwest: https://wxch.nl/2PQObdW pic.twitter.com/50DrJrDLJF",9/20/2018 13:50,https://twitter.com/weatherchannel/status/1042833266640773120,https://pbs.twimg.com/media/DnjgNeiVYAAIf6t.jpg,-1
", would you be willing to let http://Weather.com feature your post? Where and when was this taken? Verify by responding with the hashtag # yesweather. Terms: https://weather.com/en-US/twc/privacy-policy …",9/20/2018 13:06,https://twitter.com/weatherchannel/status/1042822244056145920,,1
", would you be willing to let http://Weather.com feature your post? Where and when was this taken? Verify by responding with the hashtag # yesweather. Terms: https://weather.com/en-US/twc/privacy-policy …",9/20/2018 13:05,https://twitter.com/weatherchannel/status/1042822071259152384,,1
", we'd love to feature your post on http://Weather.com ! Where and when did you take it? To let us know if we have your permission, respond using the hashtag # yesweather. https://weather.com/en-US/twc/privacy-policy …",9/20/2018 12:02,https://twitter.com/weatherchannel/status/1042806325506449408,,1
Best mail ever? Excited to see our meteorologists on the cover of the new @ LandsEnd catalog!pic.twitter.com/PMtRFoH2yF,9/20/2018 11:34,https://twitter.com/weatherchannel/status/1042799199996260352,https://pbs.twimg.com/media/DnjENxpVsAAoDnp.jpg,1
"Analysis: Hurricane # Florence and Hurricane # Harvey both caused disastrous flooding, but Harvey's rainfall was in another league: https://wxch.nl/2DdHroM pic.twitter.com/HO94QVfJsV",9/20/2018 10:43,https://twitter.com/weatherchannel/status/1042786276276150272,https://pbs.twimg.com/media/Dni4cbqX0AIK1Zs.jpg,-1
"Where and when did you take this? Could we at http://Weather.com feature your post on our platforms? If so, verify by responding with the hashtag # yesweather. View terms at https://weather.com/en-US/twc/privacy-policy ….",9/20/2018 9:01,https://twitter.com/weatherchannel/status/1042760619991228416,,0
"Where and when did you take this? Could we at http://Weather.com feature your post on our platforms? If so, verify by responding with the hashtag # yesweather. View terms at https://weather.com/en-US/twc/privacy-policy ….",9/20/2018 8:46,https://twitter.com/weatherchannel/status/1042756913233051649,,0
"Where and when did you take this? Could we at http://Weather.com feature your post on our platforms? If so, verify by responding with the hashtag # yesweather. View terms at https://weather.com/en-US/twc/privacy-policy ….",9/20/2018 8:44,https://twitter.com/weatherchannel/status/1042756392535384064,,0
"Pattern change next week will bring an extended stretch of cooler conditions to central, eastern U.S.: https://wxch.nl/2NsuRXq pic.twitter.com/FYdVz1lDPq",9/20/2018 8:39,https://twitter.com/weatherchannel/status/1042755001146331136,https://pbs.twimg.com/media/DniJxoPVAAEULuk.jpg,0
# Severe thunderstorms and a # flood threat will spread from the upper Midwest to the Northeast Thursday-Friday: https://wxch.nl/2PQObdW pic.twitter.com/vXwxyKX6Jv,9/20/2018 7:49,https://twitter.com/weatherchannel/status/1042742418024493056,https://pbs.twimg.com/media/Dnhz9DMXcAA6l2o.jpg,0
More heavy # rain and # severe storms are expected to soak the # flood-weary Midwest and Northeast through Friday: https://wxch.nl/2PSn5TL pic.twitter.com/We6Ntk4MKZ,9/19/2018 17:18,https://twitter.com/weatherchannel/status/1042523224058355712,,1
"Aerial views of Topsail Beach, North Carolina before and after Hurricane # Florence.pic.twitter.com/AsyzQ1BBuO",9/19/2018 17:10,https://twitter.com/weatherchannel/status/1042521366510149632,,0
We LOVE this! Thanks for sharing!,9/19/2018 17:09,https://twitter.com/weatherchannel/status/1042521073479311360,,1
Refreshing pattern change will bring relief from the heat and humidity in the central and eastern U.S. next week: https://wxch.nl/2PPGHYB pic.twitter.com/nUKaJLAzUp,9/19/2018 13:53,https://twitter.com/weatherchannel/status/1042471634370785280,https://pbs.twimg.com/media/DneUWEcWsAE6pkF.jpg,1
"A year after Hurricane Maria, Puerto Ricans who moved to the mainland U.S. are still living with essential uncertaintieshttps://features.weather.com/exodus/chapter/still-feel-lost/ …",9/19/2018 13:49,https://twitter.com/weatherchannel/status/1042470627016237057,,0
# Fall begins on Saturday. Here are four things to know about the 2018 autumnal equinox: https://wxch.nl/2ODbebZ pic.twitter.com/5Hjhw1knv0,9/19/2018 13:12,https://twitter.com/weatherchannel/status/1042461315976126464,https://pbs.twimg.com/media/DneL9qPX4AElXMv.jpg,0
One person has died as # StormAli lashes Ireland and parts of Scotland and England: https://wxch.nl/2xlOGWw pic.twitter.com/a3XMmHjwVj,9/19/2018 12:43,https://twitter.com/weatherchannel/status/1042454188549136384,https://pbs.twimg.com/media/DneKAhkX4AEQfi4.jpg,0
Before and after aerial imagery from @ NOAA shows the devastating # flooding from # Florence in North Carolina: https://wxch.nl/2xxVuQe pic.twitter.com/wz2aGYzqTS,9/19/2018 12:31,https://twitter.com/weatherchannel/status/1042451246446268416,,-1
Atlantic basin is quieter now with just two areas that have a low chance of # tropical development over the next 5 days: https://wxch.nl/2MLu139 pic.twitter.com/l79OeAlj6g,9/19/2018 8:42,https://twitter.com/weatherchannel/status/1042393367856869376,https://pbs.twimg.com/media/DndHOepVsAE0yCk.jpg,0
Yet another huge honor for our year-long United States of Climate Change special!https://twitter.com/ScienceWriters/status/1042131826033090561 …,9/19/2018 8:04,https://twitter.com/weatherchannel/status/1042383900729856005,,1
More heavy rain and # severe storms are expected to move through the Midwest and Northeast into late week: https://wxch.nl/2NRgVpD pic.twitter.com/xcshedegO3,9/19/2018 7:57,https://twitter.com/weatherchannel/status/1042382043534028801,https://pbs.twimg.com/media/Dnc-fvXXoAAjY4p.jpg,-1
"Our temperature outlook for fall and early winter is in. Here's what to expect in October, November and December: https://wxch.nl/2DbMHcO pic.twitter.com/LXtn2yZ5DA",9/18/2018 21:17,https://twitter.com/weatherchannel/status/1042221072886714368,https://pbs.twimg.com/media/Dna2M_bVYAE20YO.jpg,1
More heavy rain and # severe storms will soak the flood-weary Midwest and Northeast through Friday: https://wxch.nl/2QGfkBu pic.twitter.com/wxJLBfAaqP,9/18/2018 15:21,https://twitter.com/weatherchannel/status/1042131517126926336,https://pbs.twimg.com/media/DnZk8L6X0AM3d-A.jpg,1
". @ GetSpectrum has opened over 5,100 # SpectrumWiFi hotspots in NC and SC to help everyone stay connected for free during the recovery from # HurricaneFlorence. Check out https://www.spectrum.com/wifi-hotspots for more information.pic.twitter.com/Xmgl0bKeeF",9/18/2018 13:10,https://twitter.com/weatherchannel/status/1042098526883381249,https://pbs.twimg.com/media/DnZG1tDXoAQjrMa.jpg,1
", would you be willing to let http://Weather.com feature your post? Where and when was this taken? Verify by responding with the hashtag # yesweather. Terms:https://weather.com/en-US/twc/privacy-policy …",9/18/2018 11:36,https://twitter.com/weatherchannel/status/1042074819607646208,,1
"Where and when did you take this? Could we at http://Weather.com feature your post on our platforms? If so, verify by responding with the hashtag # yesweather. View terms at https://weather.com/en-US/twc/privacy-policy ….",9/18/2018 11:36,https://twitter.com/weatherchannel/status/1042074773197676544,,0
Flash flood threat remains from the Carolinas to the Northeast with exiting rain from # Florence and rising river levels. There is also a severe weather and flood threat in the Midwest today. We are LIVE in the field and studio with the latest conditions and forecast.pic.twitter.com/obzoMjqJLx,9/18/2018 10:05,https://twitter.com/weatherchannel/status/1042051986751991809,https://pbs.twimg.com/media/DnYcW0UX0AAio0J.jpg,1
What's ahead in the tropics after # Florence? https://wxch.nl/2xrwgD5 pic.twitter.com/4ChEKQ1uBn,9/18/2018 9:38,https://twitter.com/weatherchannel/status/1042045072903028736,,0
One researcher calculated # Florence dumped 10 trillion gallons of rain in the Carolinas. Here's some perspective on how much water that is: https://wxch.nl/2xjn0Sc pic.twitter.com/WwSlLPjK5v,9/18/2018 8:51,https://twitter.com/weatherchannel/status/1042033245527920643,https://pbs.twimg.com/media/DnXs0YYWwAExgRr.jpg,1
"If you're still sweating in September, our latest # fall outlook may have a big change in store in October. https://wxch.nl/2PHWTuX pic.twitter.com/ILZa5PHrgD",9/18/2018 8:07,https://twitter.com/weatherchannel/status/1042022172259041280,https://pbs.twimg.com/media/DnXeenbXgAELEFw.jpg,1
"It was a deadly day in Virginia as several tornadoes ripped through the state Monday, causing significant damage and killing one person: https://wxch.nl/2MHY9Mt pic.twitter.com/AMsTiBRD1e",9/17/2018 23:50,https://twitter.com/weatherchannel/status/1041897249167626240,,1
"After Florence, the # tropical Atlantic Basin has calmed down, but the # hurricane season is far from over: https://wxch.nl/2PGKOWP pic.twitter.com/xxIQpwF6Hg",9/17/2018 21:39,https://twitter.com/weatherchannel/status/1041864229912014850,https://pbs.twimg.com/media/DnVxyu-WsAAElLA.jpg,-1
"Three television stations are running out of gas to power their generators in Wilmington, North Carolina, and are on the brink of going dark: https://wxch.nl/2QEyCHu pic.twitter.com/59yabMcMDu",9/17/2018 20:37,https://twitter.com/weatherchannel/status/1041848635393273857,https://pbs.twimg.com/media/DnVjZfVX0AU6a2p.jpg,-1
"UPDATE: One person has died and another injured as tornadoes in the Richmond, Virginia, area cause significant damage:https://wxch.nl/2xhMmQo",9/17/2018 17:40,https://twitter.com/weatherchannel/status/1041804204610920454,,1
"BREAKING: # Florence's remnants spawn tornadoes in the mid-Atlantic. Damage has been reported near Richmond, Virginia. Frequent updates here: https://wxch.nl/2xhMmQo pic.twitter.com/GYj5QFlgIx",9/17/2018 17:15,https://twitter.com/weatherchannel/status/1041797771337052164,https://pbs.twimg.com/media/DnU1MrdX4AAKyyW.jpg,1
"The remnants of # Florence have moved north, but the flood risk remains in the Carolinas with more than one dozen rivers expected to reach record crests this week. Our LIVE coverage continues.pic.twitter.com/l5hRRqY69q",9/17/2018 16:30,https://twitter.com/weatherchannel/status/1041786388155441152,,1
"NEW: # Tornado watch issued for the District of Columbia, central Maryland and eastern Virginia until 10 p.m. EDT. This watch area includes Richmond, Virginia, and Washington D.C.pic.twitter.com/D2QxjbS61F",9/17/2018 15:47,https://twitter.com/weatherchannel/status/1041775575336148993,https://pbs.twimg.com/media/DnUhXVtW0AAdkTm.jpg,1
Where and when did you take this? Can we at http://Weather.com have permission to feature your post? Verify using the hashtag # yesweather. Terms:https://weather.com/en-US/twc/privacy-policy …,9/17/2018 13:05,https://twitter.com/weatherchannel/status/1041734840561946625,,0
"We'd love to feature this on our platforms! When and where did you take this? To give http://Weather.com permission, respond with # yesweather. View the terms here: https://weather.com/en-US/twc/privacy-policy …",9/17/2018 13:04,https://twitter.com/weatherchannel/status/1041734754444484610,,1
"We at http://Weather.com would like to feature your post. Where and when did you take this? If we have your permission, respond using the hashtag # yesweather. Full terms at https://weather.com/en-US/twc/privacy-policy ….",9/17/2018 13:03,https://twitter.com/weatherchannel/status/1041734453910024192,,1
"We'd love to feature this on our platforms! When and where did you take this? To give http://Weather.com permission, respond with # yesweather. View the terms here: https://weather.com/en-US/twc/privacy-policy …",9/17/2018 13:01,https://twitter.com/weatherchannel/status/1041733978733072384,,1
"Where and when did you take this? Could we at http://Weather.com feature your post on our platforms? If so, verify by responding with the hashtag # yesweather. View terms at https://weather.com/en-US/twc/privacy-policy ….",9/17/2018 12:59,https://twitter.com/weatherchannel/status/1041733334118944768,,0
"Where and when did you take this? Could we at http://Weather.com feature your post on our platforms? If so, verify by responding with the hashtag # yesweather. View terms at https://weather.com/en-US/twc/privacy-policy ….",9/17/2018 12:57,https://twitter.com/weatherchannel/status/1041732989594554368,,0
", would you be willing to let http://Weather.com feature your post? Where and when was this taken? Verify by responding with the hashtag # yesweather. Terms: https://weather.com/en-US/twc/privacy-policy …",9/17/2018 12:57,https://twitter.com/weatherchannel/status/1041732817628143618,,1
". @ mikebettes helps people stuck in a car that stalled out in flood waters from # Florence. This is why we tell you not to drive over flooded roads. Always remember to turn around, don't drown. Our LIVE coverage of the ongoing flood threat continues.pic.twitter.com/He4vctTvGn",9/17/2018 12:23,https://twitter.com/weatherchannel/status/1041724308584886275,,1
"Wilmington, North Carolina, has already had its wettest year on record with 3 months left in 2018: https://wxch.nl/2D2faBO # Florencepic.twitter.com/4sUkuxfOVv",9/17/2018 11:57,https://twitter.com/weatherchannel/status/1041717679646801920,,0
Millions in the Mid-Atlantic and Northeast are under Flash Flood Watches as the remnant moisture from # Florence heads north. The flood threat continues in the Carolinas with nearly 20 rivers expected to crest in major flood stage this week. Our LIVE coverage continues.pic.twitter.com/WwDa2E528L,9/17/2018 11:47,https://twitter.com/weatherchannel/status/1041715167199932418,https://pbs.twimg.com/media/DnTqDqTU4AIlAup.jpg,1
Update: New preliminary data indicates 13 different locations in NC have now topped the state's previous # tropical cyclone rain record. Four locations in SC have topped that state's previous record. (Kudos @ DRmetwatch) # Florence https://wxch.nl/2ple9Lv pic.twitter.com/3WzGOvMsON,9/17/2018 10:42,https://twitter.com/weatherchannel/status/1041698818474082304,https://pbs.twimg.com/media/DnTbdruWwAEbph8.jpg,-1
", we'd love to feature your post on http://Weather.com ! Where and when did you take it? To let us know if we have your permission, respond using the hashtag # yesweather. https://weather.com/en-US/twc/privacy-policy …",9/17/2018 10:11,https://twitter.com/weatherchannel/status/1041691058843922434,,1
"We'd love to feature this on our platforms! When and where did you take this? To give http://Weather.com permission, respond with # yesweather. View the terms here: https://weather.com/en-US/twc/privacy-policy …",9/17/2018 10:11,https://twitter.com/weatherchannel/status/1041691015126634496,,1
Where and when did you take this? Can we at http://Weather.com have permission to feature your post? Verify using the hashtag # yesweather. Terms:https://weather.com/en-US/twc/privacy-policy …,9/17/2018 9:26,https://twitter.com/weatherchannel/status/1041679742884208640,,0
Four locations have set new river # flood levels from # Florence. Trailing rainbands continue in parts of NC/VA as the threat of additional # flooding rain spreads into the Northeast through Tuesday. https://wxch.nl/2QwJHtY pic.twitter.com/I1gilbfzLB,9/17/2018 6:48,https://twitter.com/weatherchannel/status/1041639919062605824,https://pbs.twimg.com/media/DnSl6sOWsAAXC79.jpg,1
# Florence has made travel extremely difficult. Please listen to your local officials to know when it's safe to travel again. Turn to The Weather Channel for the latest updates.pic.twitter.com/vQTH4L9pS0,9/16/2018 23:51,https://twitter.com/weatherchannel/status/1041535028067557376,,1
We're glad you liked our Storm Surge Immersive Mixed Reality explainer! You can switch to get The Weather Channel's hurricane coverage on @ comcast @ GetSpectrum @ directv @ dish,9/16/2018 23:12,https://twitter.com/weatherchannel/status/1041525277824888832,,1
You can switch to get The Weather Channel's hurricane coverage on @ comcast @ GetSpectrum @ directv @ dish,9/16/2018 23:11,https://twitter.com/weatherchannel/status/1041524925268455424,,0
You can switch to get The Weather Channel's # Florence coverage on @ comcast @ GetSpectrum @ directv @ dish,9/16/2018 23:09,https://twitter.com/weatherchannel/status/1041524565271347200,,0
NEW: # Tornado watch issued for southeastern North Carolina and far northeastern South Carolina until 5 a.m. EDT.pic.twitter.com/43S5O2XnNk,9/16/2018 23:01,https://twitter.com/weatherchannel/status/1041522624222961664,https://pbs.twimg.com/media/DnQ7TplW0AA0fPH.jpg,1
