Tweets,date,source,image_url,sentiment
"Where and when did you take this? Could we at http://Weather.com feature your post on our platforms? If so, verify by responding with the hashtag # yesweather. View terms at https://weather.com/en-US/twc/privacy-policy ….",9/13/2018 22:01,https://twitter.com/weatherchannel/status/1040420207167197184,,0
"We'd love to feature this on our platforms! When and where did you take this? To give http://Weather.com permission, respond with # yesweather. View the terms here: https://weather.com/en-US/twc/privacy-policy …",9/13/2018 22:00,https://twitter.com/weatherchannel/status/1040419992225935360,,1
This is how @ WaffleHouse will help determine how bad Hurricane # Florence is: https://wxch.nl/2Qn2isx pic.twitter.com/JHWjHuNltk,9/13/2018 21:17,https://twitter.com/weatherchannel/status/1040409042777190400,https://pbs.twimg.com/media/DnBDvv4X4AASAPl.jpg,-1
A list of peak wind gusts from Hurricane # Florence so far: https://wxch.nl/2MtGlVl pic.twitter.com/0R0sAjlX5d,9/13/2018 21:10,https://twitter.com/weatherchannel/status/1040407338316967941,https://pbs.twimg.com/media/DnBExu4XsAALIgc.jpg,1
NEW: # Tornado watch issued for parts of eastern North Carolina until Friday at 7 a.m. EDT. # Florencepic.twitter.com/nmWZtaSlYB,9/13/2018 21:02,https://twitter.com/weatherchannel/status/1040405317534855169,https://pbs.twimg.com/media/DnBDH1oXoAE-psI.jpg,1
"# Florence remains a 100 mph hurricane, but has come to a crawl. The slow forward speed of the storm will lead to hours, if not days, of heavy rain, wind, and storm surge for many places along the coast of the Carolinas. Watch our LIVE coverage all through the night.pic.twitter.com/x0M21TybYQ",9/13/2018 20:53,https://twitter.com/weatherchannel/status/1040403036131262470,https://pbs.twimg.com/media/DnBA7YsWwAAziRe.jpg,1
"Life-threatening storm surge is expected from Hurricane # Florence, and for some parts of the Carolinas, it's already happening. Stay with our LIVE 24/7 coverage so you can get the latest details from our experts.pic.twitter.com/KEPoQW8Rh0",9/13/2018 20:25,https://twitter.com/weatherchannel/status/1040396065084780544,,1
"8 p.m. EDT Thursday update: # Florence remains a Category 2 # hurricane with 100-mph maximum sustained winds. Wind gusts have reached as high as 99 mph at Fort Macon, North Carolina, while 6 feet of storm surge is flooding the western Pamlico Sound.pic.twitter.com/5JWb7RieTU",9/13/2018 20:13,https://twitter.com/weatherchannel/status/1040393069940625408,https://pbs.twimg.com/media/DnA3zjtXsAAdG7z.jpg,1
"Significant storm-surge flooding is already inundating New Bern, North Carolina, as of this evening. Here's the latest on # Florence: https://wxch.nl/2xcRDbP pic.twitter.com/kiuwURvXhn",9/13/2018 19:17,https://twitter.com/weatherchannel/status/1040378918501527553,,1
Here's the latest on Hurricane # Florence. We are LIVE with 24/7 coverage throughout the storm to bring you up-to-date information.pic.twitter.com/BTJGKhcMVg,9/13/2018 18:39,https://twitter.com/weatherchannel/status/1040369508404342784,,1
"Hurricane # Florence has strengthened again, with maximum sustained winds increasing from 100 mph to 105 mph in the past hour: https://wxch.nl/2NIGHMo pic.twitter.com/3dkSZtSYYn",9/13/2018 18:27,https://twitter.com/weatherchannel/status/1040366354573012993,https://pbs.twimg.com/media/DnAfjIeXcAAsgHo.jpg,-1
Hurricane-force winds from # Florence are now beginning to reach the North Carolina coast. We have 18 crews in the field and several teams in studio as our LIVE 24/7 coverage continues to keep you updated on the latest conditions and forecast.pic.twitter.com/qaCXJptokM,9/13/2018 17:41,https://twitter.com/weatherchannel/status/1040354701613654016,https://pbs.twimg.com/media/DnAUtKsX4AAoI__.jpg,1
"Hurricane # Florence is within 100 miles of the North Carolina coast, but it has slowed way down, moving at just 5 mph. # Hurricane-force winds will arrive on the coast tonight and persist into Friday due to the slow forward speed: https://wxch.nl/2Mtcqgf pic.twitter.com/tAodwF2FyF",9/13/2018 17:31,https://twitter.com/weatherchannel/status/1040352168241516544,https://pbs.twimg.com/media/DnASJtWX4AAuuon.jpg,-1
"# Florence remains a large # hurricane, and will continue to batter the Carolina coast and areas inland through the night with hurricane and tropical storm force wind, heavy rain and storm surge. We are with you all day and night to bring you the latest conditions and updatespic.twitter.com/V1lLvAxDWZ",9/13/2018 17:13,https://twitter.com/weatherchannel/status/1040347790738694145,https://pbs.twimg.com/media/DnAN46tWsAA9CTd.jpg,1
"No Atlantic # hurricane name has been used longer than # Florence, but it likely won’t be used again. https://wxch.nl/2p39Eou pic.twitter.com/H0pt7jFVao",9/13/2018 16:28,https://twitter.com/weatherchannel/status/1040336401546526720,https://pbs.twimg.com/media/DnAEaDjWwAAgdB1.jpg,0
"# Hurricane # Florence remains a powerful hurricane and its size has grown since yesterday, with more people expected to be impacted by tropical storm force wind and heavy rain into the weekend. Our LIVE 24/7 coverage continues.pic.twitter.com/6c9YNopYXu",9/13/2018 15:40,https://twitter.com/weatherchannel/status/1040324273334874112,,1
# Florence could knock out power to 1-3 million customers in the Carolinas: https://wxch.nl/2NCIbYR pic.twitter.com/dhdhhpW7t5,9/13/2018 15:03,https://twitter.com/weatherchannel/status/1040314923723763712,https://pbs.twimg.com/media/Dm_TnlnV4AAR0Ji.jpg,0
Storm surge will be a huge factor for Hurricane # Florence Check out what it might look like with @TWCErikaNavarro:pic.twitter.com/TPqTZTmiAM,9/13/2018 14:26,https://twitter.com/weatherchannel/status/1040305773664980993,,1
Here's how you can help those in the path of # Florence: https://wxch.nl/2Oi2zvm pic.twitter.com/tBymQOQdhR,9/13/2018 14:24,https://twitter.com/weatherchannel/status/1040305108419010561,https://pbs.twimg.com/media/Dm_VskNU4AAD9kH.jpg,0
"Power outages have already started as the outer bands of # Hurricane # Florence make their way onshore in North Carolina. Conditions will continue to deteriorate. @ TWCChrisBruin is LIVE in Columbia, SC, @ mikeseidel is in Wilmington & @TWCErikaNavarro is in studio with the latest.pic.twitter.com/eZqWN4xKA9",9/13/2018 14:15,https://twitter.com/weatherchannel/status/1040303015603970052,,1
A wind gust to 70 mph has been reported on the North Carolina coast as # Florence approaches. Here's the latest on what to expect as conditions worsen into the evening: https://wxch.nl/2QtuVnE pic.twitter.com/WTCHXnJhCT,9/13/2018 13:58,https://twitter.com/weatherchannel/status/1040298807353925632,https://pbs.twimg.com/media/Dm_iAb0VAAAwDae.jpg,1
Where and when did you take this? Can we at http://Weather.com have permission to feature your post? Verify using the hashtag # yesweather. Terms:https://weather.com/en-US/twc/privacy-policy …,9/13/2018 13:08,https://twitter.com/weatherchannel/status/1040286190111469568,,0
VIDEO - Waves crash through homes in North Carolina: https://wxch.nl/2p6yaoU pic.twitter.com/zPXhdAfpBi,9/13/2018 13:07,https://twitter.com/weatherchannel/status/1040285977384824833,https://pbs.twimg.com/media/Dm_WHsFVYAAE5tc.jpg,0
# Florence likely to be Carolinas' third # hurricane-related flood event in four years: https://wxch.nl/2CUaxcV pic.twitter.com/A76m2sTIhH,9/13/2018 12:07,https://twitter.com/weatherchannel/status/1040270775947804673,https://pbs.twimg.com/media/Dm_IkUeUUAEH-VZ.jpg,0
Thanks Mary!,9/13/2018 12:02,https://twitter.com/weatherchannel/status/1040269572857835520,,1
"# Hurricane # Florence has grown in size as it approaches the Carolina coast. Feet of rain and storm surge up to 13 feet are still possible. @ Paul_Goodloe is live in Morehead City, NC, @ TWCAlexWallace is in Fayetteville and @ GregPostel is in the studio with the latest forecast.pic.twitter.com/jahzIwAKZn",9/13/2018 11:14,https://twitter.com/weatherchannel/status/1040257344867852294,https://pbs.twimg.com/media/Dm-76-GWwAAEABi.jpg,1
This is what 9 feet or more of storm surge from # Hurricane # Florence could look like along the Carolina coast. Know what to expect where you live as our 24/7 coverage continues. # ImmersiveMixedReality # IMRpic.twitter.com/KN4G0XxXNc,9/13/2018 10:11,https://twitter.com/weatherchannel/status/1040241566382739458,,1
", would you be willing to let http://Weather.com feature your post? Where and when was this taken? Verify by responding with the hashtag # yesweather. Terms: https://weather.com/en-US/twc/privacy-policy …",9/13/2018 9:29,https://twitter.com/weatherchannel/status/1040230907968466945,,1
"We'd love to feature this on our platforms! When and where did you take this? To give http://Weather.com permission, respond with # yesweather. View the terms here: https://weather.com/en-US/twc/privacy-policy …",9/13/2018 9:00,https://twitter.com/weatherchannel/status/1040223786564575233,,1
", would you be willing to let http://Weather.com feature your post? Where and when was this taken? Verify by responding with the hashtag # yesweather. Terms: https://weather.com/en-US/twc/privacy-policy …",9/13/2018 9:00,https://twitter.com/weatherchannel/status/1040223741991641090,,1
", we'd love to feature your post on http://Weather.com ! Where and when did you take it? To let us know if we have your permission, respond using the hashtag # yesweather. https://weather.com/en-US/twc/privacy-policy …",9/13/2018 9:00,https://twitter.com/weatherchannel/status/1040223651595988993,,1
An area in the Gulf of Mexico is being watched for possible development into a # tropical depression but either way more heavy rainfall is ahead for Texas: https://wxch.nl/2QtDMWq pic.twitter.com/dYc6swjJ01,9/13/2018 8:18,https://twitter.com/weatherchannel/status/1040213001108766720,https://pbs.twimg.com/media/Dm-RWQuW0AAOa9J.jpg,1
". @ comcast opened 234,000+ @ Xfinity WiFi Hotspots in Philly, Charleston, Savannah, Augusta, MD/VA/DC/DE & parts of NJ/WV to non-customers & emergency personnel to help them stay connected for free in # HurricaneFlorence. Go to http://Xfinity.com/wifi to find a hotspot @ comcastcarespic.twitter.com/FuD8McYnYG",9/13/2018 8:02,https://twitter.com/weatherchannel/status/1040209149601230848,https://pbs.twimg.com/media/Dm-QqgXX0AIQ7LT.jpg,1
Here's why Hurricane # Florence will stall or move erratically: https://wxch.nl/2x7jHxc pic.twitter.com/xkL11XxYWw,9/13/2018 7:58,https://twitter.com/weatherchannel/status/1040207967830913024,,0
"Put simply, Florence is a ""Category 5 # flood threat."" https://wxch.nl/2Oja5pB pic.twitter.com/NG2g7vXctw",9/13/2018 7:33,https://twitter.com/weatherchannel/status/1040201679130378242,https://pbs.twimg.com/media/Dm-FeVMXcAUXqco.jpg,0
NEW: A # tornado watch has been issued for eastern North Carolina until 9 p.m. EDT Thursday.pic.twitter.com/pYOhAf0wkC,9/13/2018 7:09,https://twitter.com/weatherchannel/status/1040195713169350656,https://pbs.twimg.com/media/Dm-EfQ1XgAMlwJQ.jpg,1
Tropical Storm # Isaac has weakened but will bring heavy rain and gusty winds to the Lesser Antilles today: https://wxch.nl/2oUEcsp pic.twitter.com/uVIQcJmuf2,9/13/2018 6:59,https://twitter.com/weatherchannel/status/1040193199019630594,https://pbs.twimg.com/media/Dm-CBqyU0AEklEw.jpg,-1
"The siege from # Hurricane # Florence begins later, tonight with a life-threatening storm surge, catastrophic flash # flooding, damaging winds. Our latest complete forecast: https://wxch.nl/2CRPTKf pic.twitter.com/vkOdSwtt4u",9/13/2018 5:59,https://twitter.com/weatherchannel/status/1040178217980768256,https://pbs.twimg.com/media/Dm90OofXsAEw3I8.jpg,1
Our team is LIVE this morning and throughout the storm with full coverage on # Florence,9/13/2018 5:31,https://twitter.com/weatherchannel/status/1040171122732490752,,1
Storm surge and heavy rainfall is still a great threat for North Carolina and parts of the South Carolina coastline.pic.twitter.com/qtTQQ5slQv,9/13/2018 5:31,https://twitter.com/weatherchannel/status/1040171119591010304,https://pbs.twimg.com/media/Dm9trifUcAA8mqu.jpg,1
Latest Advisory: # Florence a cat 2 hurricane with maximum winds at 110 mph and expected to make landfall tonight in the Carolinas.pic.twitter.com/0mjjWoDTqm,9/13/2018 5:31,https://twitter.com/weatherchannel/status/1040171117464436736,https://pbs.twimg.com/media/Dm9tA0WUwAA8VUE.jpg,1
"Tropical storm force winds will push onshore Thursday from east to west from Hurricane # Florence. Landfall is now expected to arrive slightly sooner on the Carolina coast, but impacts from extremely heavy rain will still last for days. The latest: https://wxch.nl/2x4rHPw pic.twitter.com/LuwIb3YJLG",9/12/2018 23:15,https://twitter.com/weatherchannel/status/1040076480414470144,https://pbs.twimg.com/media/Dm8XVpZWsAA5bM8.jpg,1
"11:00 PM Update: # Hurricane # Florence has weakened to a category 2 hurricane, but it could still produce up to 13 feet of storm surge and feet of rain in parts of the Carolinas. Our LIVE coverage continues with the latest forecast.pic.twitter.com/ahQdasJ1ap",9/12/2018 23:15,https://twitter.com/weatherchannel/status/1040076377167474688,,1
"We are LIVE with you ALL day and night before, during and after # Hurricane # Florence impacts the U.S. We have 18 crews in the field to bring you the latest updates, along with our team in the studio.pic.twitter.com/gCGF7WObWW",9/12/2018 22:30,https://twitter.com/weatherchannel/status/1040065026382475265,https://pbs.twimg.com/media/Dm8IYBGWwAE-Qfk.jpg,1
Preparations need to be completed. Conditions will deteriorate throughout the day Thursday and into Friday as # Hurricane # Florence closes in on the Carolina coast. Know the latest impacts and forecast track as our LIVE 24/7 coverage continues.pic.twitter.com/WLZ6WEZfSe,9/12/2018 21:57,https://twitter.com/weatherchannel/status/1040056926795640832,,1
". @ parkertwc shows us what up to 9 feet or more of storm surge from # Hurricane # Florence could look like along the Carolina coast. Know what to expect where you live, our 24/7 LIVE coverage continues. # ImmersiveMixedReality # IMRpic.twitter.com/L4MSKuymXO",9/12/2018 20:43,https://twitter.com/weatherchannel/status/1040038147449610240,,1
"8:00 PM Update: # Hurricane # Florence has weakened slightly, but is still a major hurricane with maximum sustained winds at 115 mph. Preparations need to be completed if you are in the path. We are LIVE all night with the latest updates.pic.twitter.com/TGUomfpINg",9/12/2018 20:26,https://twitter.com/weatherchannel/status/1040033823495544832,https://pbs.twimg.com/media/Dm7xF82W0AAHYaH.jpg,1
"We now have four named systems in the Atlantic for the first time in a decade, and we're watching one more. Video: https://wxch.nl/2COkR64 pic.twitter.com/r11OYTHYsR",9/12/2018 18:18,https://twitter.com/weatherchannel/status/1040001753939406860,https://pbs.twimg.com/media/Dm7TdobXcAA1TLP.jpg,1
". @ comcast opened @ Xfinity WiFi Hotspots in greater Philadelphia, New Jersey and now all of Deleware to non-customers & emergency personnel to help them stay connected for free during # HurricaneFlorence. Go to http://Xfinity.com/wifi to find a hotspot. @ comcastcarespic.twitter.com/Wl33JO36cT",9/12/2018 17:46,https://twitter.com/weatherchannel/status/1039993720928718848,https://pbs.twimg.com/media/Dm7I-SfW4AIPXAW.jpg,1
"Tropical Storm # Olivia has made landfall in Hawaii, ushering in heavy rain and gusty winds to parts of the island chain: https://wxch.nl/2CvmOEw pic.twitter.com/fXTv4nZhnm",9/12/2018 17:31,https://twitter.com/weatherchannel/status/1039989894968430599,https://pbs.twimg.com/media/Dm7JOmpW0AA8ybZ.jpg,-1
"# Florence remains a major # hurricane with 120 mph winds. Life-threatening storm surge, flooding and damaging wind are still expected along portions of the East Coast. @ mikebettes, @ TWCAlexWilson, @ DrRickKnabb and @ TWCChrisBruin are LIVE now with the latest forecast.pic.twitter.com/VD6aWmkdwN",9/12/2018 17:12,https://twitter.com/weatherchannel/status/1039985139135197184,,1
# Hurricane # Florence remains an extremely dangerous Category 3 hurricane. Life-threatening storm surge and prolonged heavy rainfall event expected in the Carolinas. The latest: https://wxch.nl/2x4rHPw pic.twitter.com/7SvWkyT3xF,9/12/2018 17:00,https://twitter.com/weatherchannel/status/1039982217404080131,https://pbs.twimg.com/media/Dm7B74gW4AE8oBy.jpg,-1
"Where and when did you take this? Could we at http://Weather.com feature your post on our platforms? If so, verify by responding with the hashtag # yesweather. View terms at https://weather.com/en-US/twc/privacy-policy ….",9/12/2018 16:08,https://twitter.com/weatherchannel/status/1039968955148976130,,0
"We'd love to feature this on our platforms! When and where did you take this? To give http://Weather.com permission, respond with # yesweather. View the terms here: https://weather.com/en-US/twc/privacy-policy …",9/12/2018 16:08,https://twitter.com/weatherchannel/status/1039968910999805953,,1
"An important message from @ DrRickKnabb on why it's critical to prepare for # Hurricane # Florence as it's forecast to bring life-threatening storm surge, flooding and damaging winds to the East Coast.pic.twitter.com/s6hHJJ7ZKo",9/12/2018 15:21,https://twitter.com/weatherchannel/status/1039957105208422401,,1
# Hurricane # Florence could bring up to 13 feet or more of storm surge to the Carolina coast. What does that look like? We show you like nobody else can.pic.twitter.com/8XCgmzeAP8,9/12/2018 14:53,https://twitter.com/weatherchannel/status/1039950200956219392,,1
"# Florence could knock out power, vital infrastructure for weeks, FEMA says.https://wxch.nl/2Ofn8sq",9/12/2018 14:48,https://twitter.com/weatherchannel/status/1039948790541770753,,1
", would you be willing to let http://Weather.com feature your post? Where and when was this taken? Verify by responding with the hashtag # yesweather. Terms: https://weather.com/en-US/twc/privacy-policy …",9/12/2018 14:33,https://twitter.com/weatherchannel/status/1039944993350270977,,1
", we'd love to feature your post on http://Weather.com ! Where and when did you take it? To let us know if we have your permission, respond using the hashtag # yesweather.https://weather.com/en-US/twc/privacy-policy …",9/12/2018 14:32,https://twitter.com/weatherchannel/status/1039944864228679686,,1
", would you be willing to let http://Weather.com feature your post? Where and when was this taken? Verify by responding with the hashtag # yesweather. Terms: https://weather.com/en-US/twc/privacy-policy …",9/12/2018 14:31,https://twitter.com/weatherchannel/status/1039944605263966208,,1
"Where and when did you take this? May http://Weather.com have permission to feature it on our platforms? To verify, respond with # yesweather. Check out the terms at https://weather.com/en-US/twc/privacy-policy …",9/12/2018 14:30,https://twitter.com/weatherchannel/status/1039944304205152266,,0
Over 500 flights canceled ahead of # Hurricane # Florence. https://wxch.nl/2Oc1SDD pic.twitter.com/7fjYaOXCIB,9/12/2018 14:28,https://twitter.com/weatherchannel/status/1039943976894259201,https://pbs.twimg.com/media/Dm6feaKXgAAoQRJ.jpg,0
"Where and when did you take this? Could we at http://Weather.com feature your post on our platforms? If so, verify by responding with the hashtag # yesweather. View terms at https://weather.com/en-US/twc/privacy-policy ….",9/12/2018 14:27,https://twitter.com/weatherchannel/status/1039943487435812864,,0
@ nicomaounis Where and when did you take this? Can we at http://Weather.com have permission to feature your post? Verify using the hashtag # yesweather. Terms: https://weather.com/en-US/twc/privacy-policy …,9/12/2018 14:24,https://twitter.com/weatherchannel/status/1039942886945632262,,0
"Myrtle Beach evacuation process ends at 5pET today as conditions are expected to deteriorate throughout the day Thursday into Friday as # Hurricane # Florence approaches. @ TWCChrisBruin, @ mikeseidel, @ juliemartin and @ twcMarkElliot are LIVE with the latest forecast update.pic.twitter.com/7grz3wPOqw",9/12/2018 14:23,https://twitter.com/weatherchannel/status/1039942714870128640,https://pbs.twimg.com/media/Dm6dwaUU0AApYbH.jpg,1
# Hurricane # Florence is joining the ranks of some of the strangest tropical cyclone tracks on record: https://wxch.nl/2OflS8m pic.twitter.com/Vz20zAUA7b,9/12/2018 13:20,https://twitter.com/weatherchannel/status/1039926776074526723,https://pbs.twimg.com/media/Dm6PzGIX0AE1VXI.jpg,0
", we'd love to feature your post on http://Weather.com ! Where and when did you take it? To let us know if we have your permission, respond using the hashtag # yesweather. https://weather.com/en-US/twc/privacy-policy …",9/12/2018 13:20,https://twitter.com/weatherchannel/status/1039926762359205888,,1
"11:00 AM Update: # Hurricane # Florence remains a dangerous Cat 4 # hurricane, but has slowed its forward speed. @ Paul_Goodloe is LIVE in Morehead City, NC, @ TWCAlexWallace is in Fayetteville and @TWCErikaNavarro is in studio with the latest forecast track and city specific impacts.pic.twitter.com/Yu9OLtfZtT",9/12/2018 11:16,https://twitter.com/weatherchannel/status/1039895582834352128,,1
". @ twcMarkElliot and our friend @ elmo talk about how kids can help prepare in case of a flood and what to put in emergency kits. For more helpful tips, visit @ SesameCommunity's website: https://sesamestreetincommunities.org/topics/emergency-preparedness/ …pic.twitter.com/dPuVf2vLPu",9/12/2018 10:45,https://twitter.com/weatherchannel/status/1039887787238060033,,1
# Florence will pose a dangerous # flood threat not only at the coast but also for inland areas into early next week: https://wxch.nl/2OaL7Je pic.twitter.com/dZ9V1GNKOk,9/12/2018 10:05,https://twitter.com/weatherchannel/status/1039877540897153024,https://pbs.twimg.com/media/Dm5L1iaW0AAXKnC.jpg,-1
Super Typhoon # Mangkhut ( # Ompong in the Philippines) will track toward the Philippines into this weekend: track https://wxch.nl/2CPEdb8 pic.twitter.com/NED0YAwjd2,9/12/2018 9:48,https://twitter.com/weatherchannel/status/1039873262799478784,https://pbs.twimg.com/media/Dm5Ly0BXsAA2QTw.jpg,1
Tropical Storm # Isaac is expected to impact portions of the Lesser Antilles late this week: https://wxch.nl/2x54FrX pic.twitter.com/uzqam6foCB,9/12/2018 9:12,https://twitter.com/weatherchannel/status/1039864209058619392,https://pbs.twimg.com/media/Dm5K2zeX4AE0wHK.jpg,-1
We're answering your # hurricanequestions throughout the day today. Here's the latest we covered:https://twitter.com/AMHQ/status/1039853090403508225 …,9/12/2018 8:42,https://twitter.com/weatherchannel/status/1039856663300399106,,1
Disturbance in the Gulf of Mexico has a medium chance of development late this week and may bring more rain to Texas: https://wxch.nl/2OjBZBO pic.twitter.com/hKgKH4TkUG,9/12/2018 8:26,https://twitter.com/weatherchannel/status/1039852626207158274,https://pbs.twimg.com/media/Dm5KNxQWsAEZ_i1.jpg,1
"The critical forecast changes you need to know about # Hurricane # Florence, now likely to slow to a crawl, triggering catastrophic # flooding in parts of the Southeast. https://wxch.nl/2x76uo2 pic.twitter.com/Gp4GUWmAkL",9/12/2018 6:14,https://twitter.com/weatherchannel/status/1039819622478950400,https://pbs.twimg.com/media/Dm4uainU0AEkup7.jpg,-1
There was a notable westward shift in the forecast path for # Florence with the 11 p.m. EDT advisory. Uncertainty still remains on its exact track as it approaches the Carolina coast late Thursday and into Friday as an intense # hurricane: https://wxch.nl/2O78iDX pic.twitter.com/p6U8VaQbt3,9/12/2018 0:08,https://twitter.com/weatherchannel/status/1039727474819694592,https://pbs.twimg.com/media/Dm3Z9NfW4AAM5w4.jpg,1
"Our team of field reporters, meteorologists, and experts are at-the-ready to provide the latest information before, during, and after the storm. Stay tuned to The Weather Channel for all the latest on # Florence.pic.twitter.com/71K7U48Qhb",9/11/2018 23:55,https://twitter.com/weatherchannel/status/1039724029190594561,https://pbs.twimg.com/media/Dm3OsV6U0AEVB7K.jpg,1
"The immediate coast will see life-threatening storm surge approaching 12 feet in some locations. After landfall, # Florence will meander inland, leading to a prolonged, multi-day flooding event. Continue to watch The Weather Channel for the latest updates all week long.pic.twitter.com/6Max0NSggr",9/11/2018 23:15,https://twitter.com/weatherchannel/status/1039714140103876609,https://pbs.twimg.com/media/Dm3OKG9UwAEwEEG.jpg,1
"As of the 11pm EDT advisory, # Florence remains a powerful Category 4 hurricane packing max sustained winds of 140 MPH. Florence is expected to make landfall as a major hurricane somewhere along the Carolina coast overnight Thursday into Friday.pic.twitter.com/fENdNvUL9Y",9/11/2018 23:13,https://twitter.com/weatherchannel/status/1039713678055145472,https://pbs.twimg.com/media/Dm3NuvPUYAAQ9ZG.jpg,1
Because # Florence wasn't enough...the @ NHC_Atlantic now says a # tropical depression is likely form by Thursday night in the western Gulf of Mexico as it tracks toward south Texas: https://wxch.nl/2p1bNkK pic.twitter.com/UKmVOYS7Vc,9/11/2018 22:03,https://twitter.com/weatherchannel/status/1039695886471901184,https://pbs.twimg.com/media/Dm29DGTXgAASuie.jpg,0
"Message from @ TWCChrisBruin and @ DrRickKnabb: ""This hurricane means serious business"". We're LIVE now- tune in for the latest.pic.twitter.com/yQfuT13unL",9/11/2018 20:35,https://twitter.com/weatherchannel/status/1039673723123654656,,1
Tune in for the latest with our LIVE coverage 24/7 throughout the storm.,9/11/2018 20:03,https://twitter.com/weatherchannel/status/1039665826260021250,,1
"Hurricane alerts are in effect where direct landfalling impacts are likely to be the worst. Currently, this includes most of the North Carolina coastline and neighboring counties.pic.twitter.com/UZCkhjKWlJ",9/11/2018 20:03,https://twitter.com/weatherchannel/status/1039665822388703232,https://pbs.twimg.com/media/Dm2iVGVV4AAq8Y9.jpg,-1
